{
  "$schema": "https://json-schema.org/draft/2020-12/schema",
  "$id": "https://castarro.local/schemas/cloud-video-asset.schema.json",
  "title": "CloudVideoAsset",
  "type": "object",
  "required": [
    "id",
    "providerId",
    "providerFileId",
    "displayName",
    "sourceUri",
    "sizeBytes",
    "mimeType",
    "rangeReadable",
    "durationMs",
    "videoCodec",
    "audioCodec",
    "compatibilityStatus",
    "compatibilityMessage",
    "createdAt",
    "updatedAt"
  ],
  "additionalProperties": false,
  "properties": {
    "id": { "type": "string", "minLength": 1 },
    "providerId": { "type": "string", "minLength": 1 },
    "providerFileId": { "type": "string", "minLength": 1 },
    "displayName": { "type": "string", "minLength": 1 },
    "sourceUri": { "type": "string", "minLength": 1 },
    "sizeBytes": { "type": "integer", "minimum": 0 },
    "mimeType": { "type": "string" },
    "etag": { "type": ["string", "null"] },
    "checksum": { "type": ["string", "null"] },
    "rangeReadable": { "type": "boolean" },
    "durationMs": { "type": "integer", "minimum": 0 },
    "container": { "type": "string" },
    "videoCodec": { "type": "string" },
    "audioCodec": { "type": "string" },
    "width": { "type": ["integer", "null"], "minimum": 0 },
    "height": { "type": ["integer", "null"], "minimum": 0 },
    "fps": { "type": ["number", "null"], "minimum": 0 },
    "audioSampleRate": { "type": ["integer", "null"], "minimum": 0 },
    "compatibilityStatus": { "type": "string", "enum": ["ready", "needsDesktopPrep", "blocked", "unknown"] },
    "compatibilityMessage": { "type": "string" },
    "createdAt": { "type": "string", "format": "date-time" },
    "updatedAt": { "type": "string", "format": "date-time" }
  }
}
