{
  "id": "cloud-video-blocked-no-range",
  "providerId": "google-drive-main",
  "providerFileId": "drive-file-blocked-no-range",
  "displayName": "no-range-video.mp4",
  "sourceUri": "castarro://cloud/google-drive-main/drive-file-blocked-no-range",
  "sizeBytes": 524288000,
  "mimeType": "video/mp4",
  "etag": "etag-blocked-range-001",
  "checksum": "sha256:example-no-range",
  "rangeReadable": false,
  "durationMs": 900000,
  "container": "mp4",
  "videoCodec": "h264",
  "audioCodec": "aac",
  "width": 1280,
  "height": 720,
  "fps": 30,
  "audioSampleRate": 48000,
  "compatibilityStatus": "blocked",
  "compatibilityMessage": "This provider does not support reliable range reads for this file.",
  "createdAt": "2026-06-08T00:00:00Z",
  "updatedAt": "2026-06-08T00:00:00Z"
}
