{
  "id": "cloud-video-blocked-hevc",
  "providerId": "google-drive-main",
  "providerFileId": "drive-file-blocked-hevc",
  "displayName": "hevc-video.mp4",
  "sourceUri": "castarro://cloud/google-drive-main/drive-file-blocked-hevc",
  "sizeBytes": 629145600,
  "mimeType": "video/mp4",
  "etag": "etag-blocked-hevc-001",
  "checksum": "sha256:example-hevc",
  "rangeReadable": true,
  "durationMs": 1200000,
  "container": "mp4",
  "videoCodec": "hevc",
  "audioCodec": "aac",
  "width": 1920,
  "height": 1080,
  "fps": 30,
  "audioSampleRate": 48000,
  "compatibilityStatus": "needsDesktopPrep",
  "compatibilityMessage": "This video is not H.264/AAC and cannot be streamed in copy mode.",
  "createdAt": "2026-06-08T00:00:00Z",
  "updatedAt": "2026-06-08T00:00:00Z"
}
