{
  "id": "cloud-video-ready-h264-aac",
  "providerId": "google-drive-main",
  "providerFileId": "drive-file-ready-h264-aac",
  "displayName": "ready-video.mp4",
  "sourceUri": "castarro://cloud/google-drive-main/drive-file-ready-h264-aac",
  "sizeBytes": 734003200,
  "mimeType": "video/mp4",
  "etag": "etag-ready-001",
  "checksum": "sha256:example-ready",
  "rangeReadable": true,
  "durationMs": 1800000,
  "container": "mp4",
  "videoCodec": "h264",
  "audioCodec": "aac",
  "width": 1920,
  "height": 1080,
  "fps": 30,
  "audioSampleRate": 48000,
  "compatibilityStatus": "ready",
  "compatibilityMessage": "Ready to stream",
  "createdAt": "2026-06-08T00:00:00Z",
  "updatedAt": "2026-06-08T00:00:00Z"
}
